{
  "type": "https://kakune.dev/problems/not-found",
  "title": "Resource not found",
  "status": 404,
  "detail": "workflow report was not found",
  "code": "not_found",
  "message": "workflow report was not found",
  "details": null,
  "retryable": false,
  "requestId": "request-123",
  "traceId": "trace-123"
}
